id,twitterlink,caption,likes,shares,posttime,postdatetime,collecttime,videotranscriptionpath,videocontext,,politicalbias,misleading,criticism,videoaudiopairing,videocaptionpairing,audiocaptionparing,,label
1,https://x.com/MarshaBlackburn/status/1984651437687607356,"The Biden FBI Spying Scandal confirmed Americans’ worst fears about the weaponization of government under Joe Biden. It makes every American wonder: If they did this to sitting U.S. Senators, what did they do to conservatives across America?",1311,396,"8:59 AM · Nov 1, 2025",2025-11-01T15:59:10.000Z,2025/11/1 13:10,./transcription/1.vtt,,,,,,,,,,
2,https://x.com/Eternal_Saints_/status/1984092458788204614,"ICE Arrest at Salt Lake Airport Sparks City Backlash Federal agents arrested 39-year-old Marta Brizeyda Renderos Leiva at Salt Lake City International Airport on Oct. 29. According to ICE, Renderos Leiva is an illegal immigrant from El Salvador who entered the U.S. in 2007 and was ordered removed in 2020. Officials say she was taken into custody during a targeted enforcement operation and is being held pending removal. The arrest, made by Homeland Security and Border Patrol agents acting on ICE’s behalf, happened near the airport’s baggage claim area. The Salt Lake City Council called the operation “unusual” and said it “creates fear and uncertainty in our community,” emphasizing it was not coordinated with city police. The council says it’s seeking more information from federal authorities. Mayor Erin Mendenhall also condemned the incident, saying she reviewed footage of plain-clothed agents detaining the woman in a public area of the terminal. “Nothing about this incident, like so many ICE operations, makes me feel safer as an American,” she said. Both the mayor and city council reiterated that the Salt Lake City Police Department had no role in the operation and is prohibited by federal law from interfering with immigration enforcement. Video by Shanon Hale",398,70,"7:57 PM · Oct 30, 2025",2025-10-31T02:57:59.000Z,2025/11/1 14:02,./transcription/2.vtt,,,,,,,,,,
3,https://x.com/anthon7yandrews/status/1984690335021211676,Konstantin Rykov is another Russian agent who heavily influenced U.S. election interference. Here is a screen video of his FB page. At the end you will recognize a specific photo of CECOT that was on the news. Rykov’s post of it below was years earlier. Think about that 4 a bit.,10,9,"11:33 AM · Nov 1, 2025",2025-11-01T18:33:44.000Z,2025/11/1 14:05,,,,,,,,,,,
4,https://x.com/cpsavesoil/status/1984585528193450326,"A Milestone for Our Planet! At #IUCNWCC last week, Resolution 007 towards a Soil Security Law was officially adopted — a historic step recognizing that healthy, living soil is the foundation of well-being for all Life on Earth. Initiated, sponsored, and tabled by SoilSAL, Save Soil, and GCELS, this #IUCNResolution 007 is now our collective call to action. We can’t safeguard our future without safeguarding the soil beneath our feet. From supporting biodiversity preservation to climate change mitigation and adaptation, and ensuring food, water, and energy security, soil is at the heart of our planet’s health — and now, it’s one stride closer to getting the legal protection it deserves. Why it matters: ● Global recognition for urgent, comprehensive, legal protection for soil  ● Jumpstarts multi-stakeholder collaboration to develop concepts and parameters for an international convention or a global legal instrument on soil security ● Aligns fragmented global mechanisms and promotes policy coherence across local, national, regional, and international governance levels to scale soil as a nexus solution for global existential challenges ● Recognizes Indigenous peoples’ roles in soil stewardship and sustainable agriculture to revitalize soil In the words of the late Dr. Jane Goodall: “We know what we must do, so Let’s Make It Happen!” @iucn_wcel
 

#SaveSoil",128,106,"4:37 AM · Nov 1, 2025",2025-11-01T11:37:16.000Z,2025/11/1 14:08,,,,,,,,,,,
5,https://x.com/Basil_TGMD/status/1984535265717993667,NEWS: UK BORDER FORCE TO GO ON STRIKE Seriously. Would anyone notice if they did? What do they even do?,8180,1347,"1:17 AM · Nov 1, 2025",2025-11-01T08:17:32.000Z,2025/11/1 14:17,./transcription/5.vtt,,,,,,,,,,
6,https://x.com/GuruNGovernance/status/1985952341334638845,"Why Are India’s Mayor Elections Still Delayed? 

Sending loads of love and wishes from India to the newly elected mayor of New York City 🌻💙 
@ZohranKMamdani
 

@VoiceOfLocalGov
 

#LocalDemocracy #MayorElections #ZohranMamdani #SocialJustice #IGG #VoiceOfLocalGovernment",1,2,"10:08 PM · Nov 4, 2025",2025-11-05T06:08:30.000Z,2025/11/4 22:20,./transcription/6.vtt,,,,,,,,,,
7,https://x.com/BNODesk/status/1985929623104794932,"WATCH: Dash cam video shows UPS plane crash in Louisville, Kentucky",13181,1740,"8:38 PM · Nov 4, 2025",2025-11-05T04:38:13.000Z,2025/11/4 22:32,./transcription/7.vtt,,,,,,,,,,
8,https://x.com/FoxNews/status/1985934103040954468,"NEW: NYC Mayor-elect Zohran Mamdani challenges President Trump in his victory speech: “New York will remain a city of immigrants, a city built by immigrants, powered by immigrants. And as of tonight, led by an immigrant.” “So hear me, President Trump, when I say this: To get any of us, you will have to get through all of us.”",601,2107,"8:56 PM · Nov 4, 2025",2025-11-05T04:56:01.000Z,2025/11/4 22:35,./transcription/8.vtt,,,,,,,,,,
9,https://x.com/NewsHour/status/1985940834605301766,"Zohran Mamdani told Donald Trump to ""turn the volume up"" as he addressed his supporters during a victory speech after he won New York City's mayoral race, saying that the city that made the president is also the city that can show the country how to defeat him. ""We will refuse to allow those who traffic in division and hate to pit us against one another,"" Mamdani told supporters on Tuesday. ""In this moment of darkness, New York will be the light. We believe in standing up for those we love, whether you are an immigrant, a member of the trans community, any Black women that Donald Trump has fired from a federal job."" Speaking directly to the president, Mamdani then said, ""Donald Trump, since I know you're watching, I have four words for you: Turn the volume up."" Mamdani, 34, who is a self-described democratic socialist, will be the city’s youngest mayor in over a century. He will also be New York City's first Muslim mayor and person of South Asian descent to hold the role. He defeated former Gov. Andrew Cuomo, who ran as an independent, and Republican Curtis Sliwa.",67,189,"9:22 PM · Nov 4, 2025",2025-11-05T05:22:46.000Z,2025/11/4 0:00,,,,,,,,,,,
10,https://x.com/VaticanNews/status/1985831386222051380,"Pope Leo has called for “deep reflection” on the treatment of migrants in the United States. Speaking to journalists in Castel Gandolfo, just outside Rome, the Pope said that “many people who have lived for years and years” in the US, “never causing problems”, are “deeply affected” by the current situation. The Pope was responding to a question from a journalist concerning the fact that Catholic migrants detained in Chicago have been denied access to Holy Communion. He went on to stress the importance of protecting the “spiritual rights” of migrant detainees.",8598,2314,"2:07 PM · Nov 4, 2025",2025-11-04T22:07:52.000Z,2025/11/4 0:00,,,,,,,,,,,
11,https://x.com/LFCVine/status/1985846613999567277,Virgil calling out Wayne Rooney for his previous comments on live TV.👀 My captain.©️👏,3937,425,"3:08 PM · Nov 4, 2025",2025-11-04T23:08:22.000Z,2025/11/4 0:00,,,,,,,,,,,
12,https://x.com/unhealthytruth/status/1985476405786808638,"💪💪🚨🚨🚨Breaking: I am canceling my membership permanently today at gold’s gym as the location where I used to go in Los Angeles banned a woman today for speaking out because a man was staring at her in the shower, which they allow‼️‼️‼️ And he did far worse than that.",62739,12872,"2:37 PM · Nov 3, 2025",2025-11-03T22:37:18.000Z,2025/11/5 8:30,,,,,,,,,,,
13,https://x.com/usanewshq/status/1985751043737587785,"🚨BREAKING: This is 400,000 Polish patriots on the streets declaring Poland a Christian country. Should the United States do the same? The mainstream media censored this! Can we make it go viral?",26761,7479,"8:48 AM · Nov 4, 2025",2025-11-04T16:48:36.000Z,2025/11/5 8:32,,,,,,,,,,,
14,https://x.com/Rightanglenews/status/1985335916525711767,BREAKING - A Gold’s Gym in the Bronx is under fire after staff revoked a woman’s membership and escorted her out with police after she bravely confronted a man pretending to be a woman in the women’s locker room. You know what to do.,51073,15617,"5:19 AM · Nov 3, 2025",2025-11-03T13:19:02.000Z,2025/11/5 8:38,,,,,,,,,,,
15,https://x.com/EastEndJoe/status/1986035332715008139,The fake news media doesn’t want you to see this. 👇,3636,1551,"3:38 AM · Nov 5, 2025",2025-11-05T11:38:16.000Z,2025/11/5 8:42,,,,,,,,,,,
16,https://x.com/usanewshq/status/1985692249209126994,"🚨BREAKING: Liberals are lashing out after hundreds of Christians took over a mall to celebrate Jesus and not a single person looted or rioted.

What's your reaction? 
@grok",18476,2365,"4:54 AM · Nov 4, 2025",2025-11-04T12:54:59.000Z,2025/11/5 8:46,,,,,,,,,,,
17,https://x.com/animetv_jp/status/1986044081806758398,"【Official Teaser】 Cosmic Princess Kaguya! Original Anime coming to Netflix on January 22, 2026! Marks the directorial debut of Shingo Yamashita, known for the openings of JUJUTSU KAISEN, Chainsaw Man. ✨More: https://animetv-jp.net/news/netflix-to-premiere-cosmic-princess-kaguya-worldwide-in-january-2026/",4437,708,"4:13 AM · Nov 5, 2025",2025-11-05T12:13:02.000Z,2025/11/5 8:50,,,,,,,,,,,
18,https://x.com/joeroganhq/status/1985663315612512586,"Elon Musk: ""Who does Bill Gates think he is to make comments about the welfare of children, given that he frequented Jeffrey Epstein? I wouldn't want that guy to babysit my kid.""",17359,2429,"3:00 AM · Nov 4, 2025",2025-11-04T11:00:00.000Z,2025/11/5 8:55,,,,,,,,,,,
19,https://x.com/usanewshq/status/1986104013310357672,"🚨BREAKING: Liberals are melting down after rumors that a massive Jesus statue, The Christ of Liberty, is planned to be built in the New York Harbor to honor America's Christian heritage. What's your reaction?",1576,288,"8:11 AM · Nov 5, 2025",2025-11-05T16:11:11.000Z,2025/11/5 8:58,,,,,,,,,,,
20,https://x.com/DailyMail/status/1985376669071290535,Moment 'knifeman who hurt 11 people in Huntingdon train rampage storms into Peterborough barber shop moments after stabbing 14-year-old boy'.,30393,7297,"8:00 AM · Nov 3, 2025",2025-11-03T16:00:59.000Z,2025/11/5 9:02,,,,,,,,,,,
21,https://x.com/joeroganhq/status/1984423413155336378,"Elon Musk: ""The same people who are demanding that you have a vaccine passport are the same ones saying you need no ID to vote. Same people. So it's obviously hypocritical and inconsistent.""",42190,7762,"5:53 PM · Oct 31, 2025",2025-11-01T00:53:05.000Z,2025/11/5 9:45,,,,,,,,,,,
22,https://x.com/__Inty__/status/1986076499548795011,"Trump just said: Xi Jinping manages 1.4 billion people, he's very tough and smart. When I met with Xi Jinping, the officials sitting next to him were all sitting rigidly, very afraid. I hope my cabinet can be like that too! Sitting straight and upright! I've never seen people so afraid."" JD, that's not it, he likes to interrupt, I hope JD can perform like that for a few days too.",1738,243,"6:21 AM · Nov 5, 2025",2025-11-05T14:21:51.000Z,2025/11/5 9:57,,,,,,,,,,,
23,https://x.com/KenyanSays/status/1986015963867762743,"Tanzanian President Samia Suluhu was hoping her dictatorial story wouldn’t spread beyond East Africa , but now, every major global news outlet and blog is running it!",1671,718,"2:21 AM · Nov 5, 2025",2025-11-05T10:21:18.000Z,2025/11/5 10:00,,,,,,,,,,,
24,https://x.com/DOGE__news/status/1985758943101272304,They are so lost.,5245,521,"9:20 AM · Nov 4, 2025",2025-11-04T17:20:00.000Z,2025/11/5 10:03,,,,,,,,,,,
25,https://x.com/TodaysNewsco/status/1985391213374034408,He’s being hailed worldwide — a true hero.,436,73,"8:58 AM · Nov 3, 2025",2025-11-03T16:58:46.000Z,2025/11/5 10:08,,,,,,,,,,,AI
26,https://x.com/SABCNews/status/1986081754612900153,"[WATCH] Crime Intelligence Head, Lieutenant General Dumisani Khumalo says, “As the whole world knows, I’ve been arrested and removed from some responsibilities, and I could not sign off on matters that were supposed to be signed by me.”",153,49,"6:42 AM · Nov 5, 2025",2025-11-05T14:42:44.000Z,2025/11/5 10:11,,,,,,,,,,,
27,https://x.com/YourAnonNews/status/1986105360206455137,"11-5-2025 Chicago. Roscoe Village. Rayito De Sol Daycare: ICE is disappearing teachers and staff at a daycare. So much for going after ""criminals"" and the ""worst of the worst."" Trump voters are responsible for this shit.",501,233,"8:16 AM · Nov 5, 2025",2025-11-05T16:16:32.000Z,2025/11/5 10:13,,,,,,,,,,,
28,https://x.com/xIsraelExposedx/status/1986113837016158566,"Here’s the Fox News report that describes how the Mossad (Israel’s intelligence arm) has infiltrated many parts of our government, and knew about 9/11 before it happened.",351,152,"8:50 AM · Nov 5, 2025",2025-11-05T16:50:13.000Z,2025/11/5 10:15,,,,,,,,,,,
29,https://x.com/Blizzard_Ent/status/1986118376859578441,"BlizzCon Tickets go on sale Nov. 7!🚨 We’re back in Anaheim, California, Sept. 12-13, 2026. Are you in? 👀For more details & pass info: http://blizz.ly/4ou0P3m",587,197,"9:08 AM · Nov 5, 2025",2025-11-05T17:08:15.000Z,2025/11/5 10:17,,,,,,,,,,,
30,https://x.com/PTIofficial/status/1986126368619262123,"Global Pakistan | English News | Top Stories | November 5, 2025 - “Asim Munir is the most tyrannical dictator in our history and is mentally unstable”, Imran Khan slams the General as Pakistan witnesses mass civilian killings and unprecedented fascism - “I prefer death over slavery; nations that embrace the principle of ‘freedom or death’ always attain true independence”, reiterates arbitrarily detained Imran Khan #GlobalPakistan #FreeImranKhan #FascismUnderAsimLaw",132,52,"9:40 AM · Nov 5, 2025",2025-11-05T17:40:01.000Z,2025/11/5 10:19,,,,,,,,,,,
31,https://x.com/mog_Russ/status/1986040307788685366,"🚨⚡️UNBELIEVABLE: The wife of the American journalist ""Charlie Kirk,"" ""Erica Kirk,"" is caught using artificial tears solution before stepping onto the TPUSA stage to make it look like she's crying! 😅💧",976,162,"3:58 AM · Nov 5, 2025",2025-11-05T11:58:02.000Z,2025/11/5 10:33,,,,,,,,,,,
32,https://x.com/WorldNews_X_/status/1985519156322848846,🛸📡Breaking: 3I ATLAS Sent a Mysterious Message to Earth Yesterday! 😨🌍Scientists Are Still Decoding the Signal… 🚨,2529,696,"5:27 PM · Nov 3, 2025",2025-11-04T01:27:10.000Z,2025/11/5 10:38,,,,,,,,,,,
33,https://x.com/DOGE__news/status/1985474569617244347,God bless him!,7493,560,"2:30 PM · Nov 3, 2025",2025-11-03T22:30:00.000Z,2025/11/5 10:45,,,,,,,,,,,
34,https://x.com/NewsAlgebraIND/status/1985575678272815304,"SHOCKING 🚨A drunk Canadian man attacked an Indian man simply because he believed that Indian was acting superior 😳INDIAN MAN : ""You might get yourself in trouble"" CANADIAN MAN : ""Did you say that to me?"" No fear of law and order in Canada?",3332,631,"9:11 PM · Nov 3, 2025",2025-11-04T05:11:46.000Z,2025/11/5 11:19,,,,,,,,,,,
35,https://x.com/FoxNews/status/1985783300649271392,"KAROLINE LEAVITT: “If the Nigerian government continues to allow the killing of Christians, the United States will immediately stop all aid and assistance to Nigeria and may take action to wipe out the Islamic terrorists who are committing these horrible atrocities.”",6567,2018,"10:56 AM · Nov 4, 2025",2025-11-04T18:56:47.000Z,2025/11/5 11:33,,,,,,,,,,,
36,https://x.com/BreitbartNews/status/1986087269946528192,"""Bust down the door!"" When a Florida police officer heard the chilling plea for help from a 7-year-old boy being held at knife point by his brother, he didn't hesitate to save the child.",163,42,"7:04 AM · Nov 5, 2025",2025-11-05T15:04:39.000Z,2025/11/5 11:44,,,,,,,,,,,
37,https://x.com/yoxics/status/1986136533792145753,Marlon was featured on the News during his USA stream tour which shut down streets in South Dakota due to the amount of fans who showed up 🤯,448,15,"10:20 AM · Nov 5, 2025",2025-11-05T18:20:24.000Z,2025/11/5 11:47,,,,,,,,,,,
38,https://x.com/RMXnews/status/1986013885409775838,"🇮🇹🔴Italian victim's family reacted with rage after Nigerian migrant Khalid De Greata was sentenced to only 12 years in prison due to ""boat stress"" from his journey to Italy over the Mediterranean. ""In 12 years, I'll kill him,"" said the son of the victim after the verdict, which was issued in 2019. The Nigerian slit the throat of 51-year-old Maurizio Gugliotta in a market in Turin, leaving the beloved father to bleed to death on the street. ""It's a disgrace, you're heartless,"" shouted Gugliotta's relatives when the verdict was read out. The judge issued the Nigerian a reduced sentence, which was upheld by the Italian Supreme Court in 2019, because he was a migrant and had ""boat stress"" from his journey to Italy. The family did not buy the diagnosis. ""I wonder why when he entered Italy they didn't notice, didn't check him in all these months during which he roamed around our country. Is it possible that they only discover he was crazy after he killed a man?"" said Gugliotta's widow at the time. The case dated back to Oct. 17, 2017. The Nigerian slashed Maurizio Gugliotta in the throat for no reason. Gugliotta fled the Turin market after being stabbed, only to die on the street after bleeding out. The Nigerian man was found by police shortly afterwards smoking a cigarette and calmly wiping blood from his knife.",10173,2415,"2:13 AM · Nov 5, 2025",2025-11-05T10:13:03.000Z,2025/11/5 11:51,,,,,,,,,,,
39,https://x.com/HouseJudiciary/status/1986073931313254614,"In his first days in office, Trump abruptly killed the ongoing DOJ investigation into Epstein's co-conspirators. Why did that happen? Who’s Trump trying to protect? https://cbsnews.com/news/jeffrey-epstein-co-conspirators-house-democrats-jamie-raskin/",1340,777,"6:11 AM · Nov 5, 2025",2025-11-05T14:11:39.000Z,2025/11/5 11:53,,,,,,,,,,,
40,https://x.com/SkyNews/status/1985993765689893334,"In a fiery acceptance speech, Mr Mamdani said: ""If anyone can show a nation betrayed by Donald Trump how to defeat him, it is the city that gave rise to him.""

@jamesmatthewsky
 dissects how The self-proclaimed 'worst nightmare' for Trump has been victorious in the mayoral race",200,48,"12:53 AM · Nov 5, 2025",2025-11-05T08:53:06.000Z,2025/11/5 11:56,,,,,,,,,,,
41,https://x.com/DOGE__news/status/1986053383321784482,The arrogance on that man's face.,608,98,"4:50 AM · Nov 5, 2025",2025-11-05T12:50:00.000Z,2025/11/5 11:59,,,,,,,,,,,
42,https://x.com/joeroganhq/status/1984077866024497225,"Trump: ""I met the head of Somalia. I suggested that maybe he'd like to take [Ilhan Omar] back. He said, 'I don't want her.'"" Still funny.",10917,685,"7:00 PM · Oct 30, 2025",2025-10-31T02:00:00.000Z,2025/11/5 12:01,,,,,,,,,,,
43,https://x.com/joeroganhq/status/1986111265815633954,"Joe Rogan: ""The Charlie Kirk thing opened up my eyes. I never expected so many people would celebrate that man's murder. That is evil...""",2460,240,"8:40 AM · Nov 5, 2025",2025-11-05T16:40:00.000Z,2025/11/5 12:05,,,,,,,,,,,
44,https://x.com/FoxNews/status/1986157765434482904,"JUST IN: Miami Mayor Francis Suarez gifts President Trump a golden key, saying, ""This is a key that opens some really nice presidential library real estate.""",220,43,"11:44 AM · Nov 5, 2025",2025-11-05T19:44:46.000Z,2025/11/5 12:08,,,,,,,,,,,
45,https://x.com/DOGE__news/status/1984988868542951455,This made me choke 🤣,3504,423,"6:20 AM · Nov 2, 2025",2025-11-02T14:20:00.000Z,2025/11/5 12:11,,,,,,,,,,,
46,https://x.com/joeroganhq/status/1986116301862150204,Why don't they recreate this interview? Should be fun.,270,53,"9:00 AM · Nov 5, 2025",2025-11-05T17:00:01.000Z,2025/11/5 12:16,,,,,,,,,,,
47,https://x.com/joeroganhq/status/1985871796554310002,"Elon Musk: ""Social Security, disability, Medicaid – acts like a giant magnet pulling people from all over the world. If you pay people at a standard of living above 90% of Earth, then 90% of Earth has a reason to come here.""",4201,582,"4:48 PM · Nov 4, 2025",2025-11-05T00:48:26.000Z,2025/11/5 12:17,,,,,,,,,,,
48,https://x.com/DOGE__news/status/1984966219477180446,This fact-check will forever live in history.,1879,243,"4:50 AM · Nov 2, 2025",2025-11-02T12:50:00.000Z,2025/11/5 12:22,,,,,,,,,,,
49,https://x.com/SABCNews/status/1986108641464738219,WATCH | Lt-Gen. Dumisani Khumalo says that Brigadier Dineo Mokwele is qualified in mechatronics and was recruited directly from BMW. He adds that she was a supervisor of technicians in both mechanical and electrical work and met all the requirements to be hired.,478,140,"8:29 AM · Nov 5, 2025",2025-11-05T16:29:34.000Z,2025/11/5 12:25,,,,,,,,,,,
50,https://x.com/DailyLoud/status/1986160566616900057,Former FOX 2 News anchor charged with murder after allegedly stabbing her 80-year-old mother to death on Halloween.,53,12,"11:55 AM · Nov 5, 2025",2025-11-05T19:55:54.000Z,2025/11/5 12:26,,,,,,,,,,,
51,https://x.com/FoxNews/status/1986146156661879131,"PRESIDENT TRUMP: “I'm pleased to report that today the United States has the strongest economy, the strongest borders, the strongest military, the strongest friendships and the strongest spirit of any nation anywhere... This is the golden age of America.”",1067,237,"10:58 AM · Nov 5, 2025",2025-11-05T18:58:39.000Z,2025/11/5 12:29,,,,,,,,,,,
52,https://x.com/afshinrattansi/status/1986115084737749379,Italian Journalist Gabriele Nunziati: “You've said that Russia should repay for reconstruction of Ukraine. Do you believe Israel should repay for reconstruction of Gaza?” EU chief spokesperson: “I have no comment at this stage.” This journalist was fired from the Nova ‘news organisation’ in Italy for asking this question. Freedom of the press in Europe-only if you ask questions that don’t expose Europe’s blatant hypocrisy.,482,218,"8:55 AM · Nov 5, 2025",2025-11-05T16:55:11.000Z,2025/11/5 13:03,,,,,,,,,,,
53,https://x.com/TheThe1776/status/1985872715111415992,"Why is this ""breaking news"" now? A leaked document proves BBC edited Trump's Jan. 6 speech, splicing early ""peacefully march to the Capitol"" with a later ""fight like hell"" to imply insurrection. We knew this years ago, this man made videos on Jan. 7, but they got flagged as misinformation. Crazier: Trump tweeted ""go home,"" Twitter deleted it, banned him, then asked why he stayed silent. Everyone involved with the Jan 6 coup should be held accountable. This coup has destroyed many innocent lives and a few lost their lives because of it.",3804,1174,"4:52 PM · Nov 4, 2025",2025-11-05T00:52:05.000Z,2025/11/5 13:05,,,,,,,,,,,
54,https://x.com/BarronTNews_/status/1986078375987781686,"🚨LMFAO! President Trump had the whole room in TEARS laughing tonight retelling how a Chinese official froze like a statue next to Xi “I said, I want MY cabinet to behave like that! Sit up straight! I’ve never seen men so scared in my life.” “I asked one of them a question—nothing. I said, you gonna answer me? Still nothing! Another guy finally says, ‘I will answer all questions.’” Then Trump turns and jokes, “JD doesn’t behave like that! JD jumps right in! I want that for at least a few days, OK?” 😂Classic Trump — commanding the room and cracking everyone up at once.",2050,362,"6:29 AM · Nov 5, 2025",2025-11-05T14:29:19.000Z,2025/11/5 13:09,,,,,,,,,,,
55,https://x.com/EricLDaugh/status/1986166724358475805,"🚨GREAT NEWS: Sen. Tommy Tuberville is READY to nuke the filibuster. He’s with Trump. https://x.com/ReshadHudson/status/1986121284040991181/video/1 ""If we need to bust it, let's bust it. Let's knock it down to 51 and let the Senate know that the power needs to go to the president and let him get something done. If we don't, we're going to lose our country!” HES SO RIGHT! Get it done!",2552,550,"12:20 PM · Nov 5, 2025",2025-11-05T20:20:22.000Z,2025/11/5 13:11,,,,,,,,,,,
56,https://x.com/FoxNews/status/1986069479546061029,“We can’t be extorted to give $1.5 trillion dollars to people who came into the country illegally.” President Trump blasts Democrats’ demands as the government shutdown drags into Day 36.,6627,1035,"5:53 AM · Nov 5, 2025",2025-11-05T13:53:57.000Z,2025/11/5 13:15,,,,,,,,,,,
57,https://x.com/BreitbartNews/status/1986074081851330750,"Bookmark this clip of Mamdani supporters for later ""We got the best mayor possible""",459,173,"6:12 AM · Nov 5, 2025",2025-11-05T14:12:15.000Z,2025/11/5 13:19,,,,,,,,,,,
58,https://x.com/NewsAlgebraIND/status/1986162567157629061,"Trump again raises the plane count in the India-Pakistan war to eight, after earlier saying five, six, or seven. TRUMP : ""Eight planes were shot down essentially"" Still no course correction despite New York poll defeat 😅",177,27,"12:03 PM · Nov 5, 2025",2025-11-05T20:03:51.000Z,2025/11/5 13:20,,,,,,,,,,,
